area,path,evidence,verdict,gap_or_action
"Prompt and previous handoff","/Users/a10/Downloads/HESEM_MDA_V3_RUNTIME_UPGRADE_PROMPT_OS_2026-05-29/prompts/p33_canonical_quality_hold_quality_order_ncr_mrb_capa_complaint_and_scar_authority.md; P32_HANDOFF_PACKET.md","P33 must unify quality holds and quality case linkage, and P32 explicitly unlocks P33 with a regulated evidence gate for hold release and quality commands.","usable","Implement canonical hold/case gate and keep live command handlers as follow-on blockers."
"Canonical quality backbone","mom/database/migrations/078_canonical_eqms_compliance_backbone.sql","`quality_order`, `quality_case_link`, `nonconformance`, `capa`, and `complaint` already exist.","usable_with_gap","Add hold/trigger/trace spine rather than duplicate existing case tables."
"Legacy quality lanes","mom/database/migrations/011_quality.sql; mom/api/services/QualityIntegrationService.php","Legacy `ncr_records`/`capa_records` and JSONL quality services exist and create NCR/CAPA style records.","partial","P33 service must not mutate legacy JSON; it must plan canonical containment and assign migration/handler owners."
"MRB authority","mom/database/migrations/034_exception_management.sql; mom/database/migrations/069_lean_manufacturing_world_class.sql","`material_review_board` and `ncr_mrb_decisions` exist, including use-as-is/rework/scrap style dispositions.","usable_with_gap","P33 adds use-as-is regulated evidence gate but live MRB handler remains pending."
"Supplier quality and SCAR","mom/database/migrations/035_supplier_quality_management.sql; mom/api/services/SupplierQualityService.php","`scar_records` and SCAR lifecycle service exist, but supplier item approval blocking still depends on JSON/service lanes.","partial","P33 service blocks supplier approval when open critical/high/major SCAR matches supplier item."
"Warehouse quarantine holds","mom/database/migrations/050_wms_extended_warehouse.sql","`wms_quarantine_holds` exists for warehouse quarantine, but it is not a canonical cross-domain hold chain for shipment, putaway, issue and WIP.","partial","Create `quality_holds` as canonical subject/source hold authority."
"Shipment and OQC containment","docs/backend/DOMAIN_COMMAND_SPEC.md; mom/api/controllers/LogisticsController.php","Spec requires RecordOqcResult plus CreateNcrFromQualityFailure in one transaction. Legacy OQC failure creates JSON hold/NCR and ShipmentGateService guards logistics routes.","partial","P33 provides canonical OQC containment plan and active hold gate; P34/P37 must wire route/command handlers."
"Workflow/status authority","docs/backend/WORKFLOW_STATUS_UNIFICATION_SPEC.md","NCR/MRB/CAPA/SCAR canonical state sets are documented; legacy states remain mixed.","partial","P33 does not regenerate workflow/status artifacts; P37/P40 own generated parity."
"Runtime proof matrix and blockers","MDA_V3_RUNTIME_PROOF_MATRIX.csv; MDA_V3_P0_P1_BLOCKER_REGISTER.csv","P33 owns P0 canonical hold absence and P1 quality-order trigger/complaint-SCAR trace gaps.","blocking_for_readiness","Update ROOT-QUAL, ROOT-WO, ROOT-INV rows and keep live PG command/audit/outbox blockers open."
"Runtime mode","php mom/tools/audit_runtime_authority_consistency.php","Current runtime audit reports JSON_ONLY and PostgreSQL not configured/reachable.","blocking_for_runtime_claim","Do not claim POSTGRES_PRIMARY or production readiness."
"Discovery commands","pwd; git status --short; git rev-parse --short HEAD; grep/find probes","Worktree `/Users/a10/Documents/mom-mda-v3-runtime-20260529`, branch `codex/mda-v3-runtime-upgrade-20260529`, P33 starts after `3b17fd0ad`. Search found no canonical `quality_holds` table before P33.","usable","Proceed in isolated branch; original checkout and UOM work untouched."
