scenario_id,initial_state,actor,command_action,expected_gate,data_written,event_written,audit_evidence,rollback_retry,expected_result,failure_if_missing,test_to_add
SIM-P34-001,"WO start request has operator qualification expiry before command time","operator/shift_leader","StartJob","operator_qualification","resource_readiness_snapshot planned with blocked state","resource.readiness_evaluated blocked event planned","snapshot_hash_sha256 and blocker code operator_training_expired","replay with renewed qualification or different operator","start blocked","expired operator can run machine","ResourceReadinessServiceTest::testOperatorTrainingExpiredBlocksStart"
SIM-P34-002,"Machine assigned to WO has PM status overdue","shift_leader","StartJob","machine_pm_calibration","resource_readiness_snapshot planned with blocked state","resource.readiness_evaluated blocked event planned","snapshot_hash_sha256 and blocker code machine_pm_overdue","replay after maintenance close evidence","start blocked","machine runs past PM due date","ResourceReadinessServiceTest::testMachinePmOverdueBlocksStart"
SIM-P34-003,"Material lot has active canonical quality hold","material handler","IssueMaterial","material_quality_hold","resource_readiness_snapshot planned with quality_hold_refs","resource.readiness_evaluated blocked event planned","P33 hold gate evidence and blocker code material_lot_on_hold","replay after governed hold release with P32 evidence","material issue blocked","held lot is consumed into WIP","ResourceReadinessServiceTest::testMaterialLotOnHoldBlocksIssue"
SIM-P34-004,"Controller NC checksum differs from released checksum","operator","StartJob","nc_program_checksum","resource_readiness_snapshot planned with expected and actual checksums","resource.readiness_evaluated blocked event planned","blocker code nc_checksum_mismatch","replay after correct program download receipt","start blocked","wrong NC program runs on machine","ResourceReadinessServiceTest::testWrongNcChecksumBlocksStart"
SIM-P34-005,"IPQC result fails for in-process WO/lot","qc_inspector","RecordIpqcResult","quality_containment","quality_holds/nonconformance/quality_order plan from P33; live write pending","quality.containment_required event planned","plan carries nonconformance_no holds and gates_blocked","replay blocked if duplicate open case exists","WIP held and quality case plan created","failed WIP continues to completion/shipment","ResourceReadinessServiceTest::testIpqcFailHoldsWipAndCreatesQualityCasePlan"
SIM-P34-006,"Gage has expired calibration before CTQ check","operator","StartJob/TrackIn","tool_gage_readiness","resource_readiness_snapshot planned with blocker gage_calibration_expired","resource.readiness_evaluated blocked event planned","tool/gage evidence in gate_results","replay after calibration result approved","start/CTQ work blocked","invalid gage used for inspection","P35 gage/MSA focused test"
SIM-P34-007,"Same readiness command is retried with same idempotency key","command worker","ResourceReadiness.Evaluate","idempotency_unique_index","same command_name/idempotency_key must not create duplicate snapshot in PG","event idempotency unique index prevents duplicate event","P31 audit and replay evidence pending","retry returns replayed decision after live handler implementation","no duplicate readiness records","duplicate start/material decision history","P37/P38 live replay test"
