scenario_id,initial_state,actor,command_action,expected_gate,data_written,event_written,audit_evidence,rollback_retry,expected_result,failure_if_missing,test_to_add
SIM-P35-001,"Tool has 2 percent life remaining and stop threshold is 5 percent","operator","StartJob/LoadTool","tool_life_policy","tooling_life_runtime_policy decision target; live write pending","resource.readiness_evaluated/tool.loaded event target","blocker code tool_life_below_stop_threshold","replace tool and replay start","start/load blocked","tool fails during production","ToolingGageAuthorityServiceTest::testToolLifeBelowStopThresholdBlocksStart"
SIM-P35-002,"Tool breakage detected at 10:00 with last good check at 08:00","operator/qc","RecordToolBreakage","breakage_suspect_window","tool_breakage_suspect_window planned with affected lots/serials","quality containment event target via P33 plan","window_hash_sha256 and quality containment plan","review/reinspect then release/scrap","suspect output contained","bad parts escape without suspect window","ToolingGageAuthorityServiceTest::testBreakageCreatesSuspectWindowFromLastGoodCheck"
SIM-P35-003,"Gage calibration due date is before CTQ result date","qc_inspector","RecordCtqResult","gage_calibration","gage_msa_gate_policy/gage evidence target; live write pending","inspection.recorded blocked target","blocker code gage_calibration_expired","recalibrate and replay measurement","CTQ result blocked","invalid measurement accepted","ToolingGageAuthorityServiceTest::testGageCalibrationExpiredBlocksCtqResult"
SIM-P35-004,"Gage OOT discovered after WIP and shipped lots were measured","quality_engineer","AssessGageOotImpact","oot_impact_scope","gage_oot_impact_scope planned with WIP lots and shipment refs","quality containment/customer review event target","impact_hash_sha256 and shipment_review_required","reinspect/recall/customer disposition","WIP held and shipped lots flagged","OOT gage misses shipped product impact","ToolingGageAuthorityServiceTest::testOotImpactsShippedAndWipLots"
SIM-P35-005,"Tool assembly approved for 3-axis only but load is requested on 5-axis","setup_operator","LoadToolAssembly","machine_family_compatibility","tooling_machine_compatibility_rule decision target; live write pending","tool.loaded blocked event target","blocker code tool_assembly_machine_family_incompatible","choose compatible assembly and replay","load blocked","wrong holder/tool assembly damages machine/part","ToolingGageAuthorityServiceTest::testToolAssemblyIncompatibleWithMachineFamilyBlocksLoad"
SIM-P35-006,"P34 readiness is called with P35 service injected and tool below stop threshold","shift_leader","StartJob","resource_readiness_tooling_bridge","resource_readiness_snapshot planned by P34; live write pending","resource.readiness_evaluated blocked event target","P34 blocker contains tool_life_below_stop_threshold","replace tool and retry idempotently","readiness blocks start","P35 service exists but is bypassed by readiness","ToolingGageAuthorityServiceTest::testResourceReadinessCanUseToolingGageAuthority"
